{"skill_invocation":"$receipt-renamer","batch":"normal-batch","dry_run_confirmed":true,"plan_json":"reports/normal-batch-plan.json","plan_report":"reports/normal-batch-plan.md","tests_command":"npm test","tests_status":"passed","notes":"Dry-run plan created only; no receipt files were renamed. Planned targets: 2026-05-14_metro-card_USD7.25.pdf, 2026-05-15_airport-taxi_USD48.00.pdf, 2026-05-18_desk-foundry_USD124.40.pdf. npm test passed: 4/4."}
